{
  "schema": "causal-scheduler-event-day",
  "day": "SE-0061-08-05",
  "authority": true,
  "events": [
    {
      "event_id": "evt.causal.e6859a07bd9940f818de5046",
      "kind": "commitment.due",
      "due_at": "SE-0061-08-05T07:29:58",
      "priority": 30,
      "source_host": "host.commitment.team_fujin.exam_priority.0061-07-22",
      "target_host": "host.commitment.team_fujin.exam_priority.0061-07-22",
      "payload": {
        "commitment_id": "commitment.team_fujin.exam_priority.0061-07-22"
      },
      "dedupe_key": "commitment.due:commitment.team_fujin.exam_priority.0061-07-22",
      "visibility": "player_known",
      "requires_player": true,
      "causation_id": null,
      "correlation_id": null
    },
    {
      "event_id": "evt.causal.38ac87d420f8ec6169f51a41",
      "kind": "canon_pressure.periodic_review",
      "due_at": "SE-0061-08-05T18:00:00",
      "priority": 80,
      "source_host": "host.canon_pressure.pressure_mizuki_forbidden_scroll",
      "target_host": "host.canon_pressure.pressure_mizuki_forbidden_scroll",
      "payload": {
        "identity": "pressure_mizuki_forbidden_scroll",
        "owner_ref": "state/canon/pressures.json",
        "pressure_id": "pressure_mizuki_forbidden_scroll",
        "recurrence": {
          "accrual_mode": "boundary_only",
          "interval_seconds": 604800,
          "kind": "fixed_interval"
        }
      },
      "dedupe_key": "canon_pressure.periodic_review:pressure_mizuki_forbidden_scroll",
      "visibility": "hidden",
      "requires_player": false,
      "causation_id": null,
      "correlation_id": null
    }
  ]
}
